{
  "schema": "axm.structural-habitat/v0.4.0",
  "revision": 2,
  "nextRoomCounter": 5,
  "entrance": {
    "x": 0,
    "y": 9,
    "side": "west",
    "kind": "exterior_door"
  },
  "structuralCondition": 100,
  "partitions": [
    {
      "id": "H:0:1",
      "key": "H:0:1",
      "kind": "door",
      "materialId": "reclaimed_timber",
      "condition": 100,
      "loadBearing": false,
      "createdDay": 2,
      "door": {
        "styleId": "simple",
        "open": true,
        "lockPolicy": "household_members",
        "condition": 84
      },
      "history": []
    },
    {
      "id": "H:0:6",
      "key": "H:0:6",
      "kind": "wall",
      "materialId": "timber_frame",
      "condition": 73,
      "loadBearing": false,
      "createdDay": 1,
      "door": null,
      "history": []
    },
    {
      "id": "H:1:6",
      "key": "H:1:6",
      "kind": "wall",
      "materialId": "timber_frame",
      "condition": 73,
      "loadBearing": false,
      "createdDay": 1,
      "door": null,
      "history": []
    },
    {
      "id": "H:10:6",
      "key": "H:10:6",
      "kind": "wall",
      "materialId": "timber_frame",
      "condition": 73,
      "loadBearing": false,
      "createdDay": 1,
      "door": null,
      "history": []
    },
    {
      "id": "H:11:6",
      "key": "H:11:6",
      "kind": "door",
      "materialId": "timber_frame",
      "condition": 73,
      "loadBearing": false,
      "createdDay": 1,
      "door": {
        "styleId": "simple",
        "open": true,
        "lockPolicy": "household_members",
        "condition": 84
      },
      "history": []
    },
    {
      "id": "H:12:3",
      "key": "H:12:3",
      "kind": "wall",
      "materialId": "timber_frame",
      "condition": 73,
      "loadBearing": false,
      "createdDay": 1,
      "door": null,
      "history": []
    },
    {
      "id": "H:12:6",
      "key": "H:12:6",
      "kind": "wall",
      "materialId": "timber_frame",
      "condition": 73,
      "loadBearing": false,
      "createdDay": 1,
      "door": null,
      "history": []
    },
    {
      "id": "H:13:3",
      "key": "H:13:3",
      "kind": "door",
      "materialId": "timber_frame",
      "condition": 73,
      "loadBearing": false,
      "createdDay": 1,
      "door": {
        "styleId": "simple",
        "open": true,
        "lockPolicy": "household_members",
        "condition": 84
      },
      "history": []
    },
    {
      "id": "H:13:6",
      "key": "H:13:6",
      "kind": "wall",
      "materialId": "timber_frame",
      "condition": 73,
      "loadBearing": false,
      "createdDay": 1,
      "door": null,
      "history": []
    },
    {
      "id": "H:14:3",
      "key": "H:14:3",
      "kind": "wall",
      "materialId": "timber_frame",
      "condition": 73,
      "loadBearing": false,
      "createdDay": 1,
      "door": null,
      "history": []
    },
    {
      "id": "H:14:6",
      "key": "H:14:6",
      "kind": "wall",
      "materialId": "timber_frame",
      "condition": 73,
      "loadBearing": false,
      "createdDay": 1,
      "door": null,
      "history": []
    },
    {
      "id": "H:2:6",
      "key": "H:2:6",
      "kind": "wall",
      "materialId": "timber_frame",
      "condition": 73,
      "loadBearing": false,
      "createdDay": 1,
      "door": null,
      "history": []
    },
    {
      "id": "H:3:6",
      "key": "H:3:6",
      "kind": "wall",
      "materialId": "timber_frame",
      "condition": 73,
      "loadBearing": false,
      "createdDay": 1,
      "door": null,
      "history": []
    },
    {
      "id": "H:4:6",
      "key": "H:4:6",
      "kind": "door",
      "materialId": "timber_frame",
      "condition": 73,
      "loadBearing": false,
      "createdDay": 1,
      "door": {
        "styleId": "simple",
        "open": true,
        "lockPolicy": "household_members",
        "condition": 84
      },
      "history": []
    },
    {
      "id": "H:5:6",
      "key": "H:5:6",
      "kind": "wall",
      "materialId": "timber_frame",
      "condition": 73,
      "loadBearing": false,
      "createdDay": 1,
      "door": null,
      "history": []
    },
    {
      "id": "H:6:6",
      "key": "H:6:6",
      "kind": "wall",
      "materialId": "timber_frame",
      "condition": 73,
      "loadBearing": false,
      "createdDay": 1,
      "door": null,
      "history": []
    },
    {
      "id": "H:7:6",
      "key": "H:7:6",
      "kind": "wall",
      "materialId": "timber_frame",
      "condition": 73,
      "loadBearing": false,
      "createdDay": 1,
      "door": null,
      "history": []
    },
    {
      "id": "H:8:6",
      "key": "H:8:6",
      "kind": "wall",
      "materialId": "timber_frame",
      "condition": 73,
      "loadBearing": false,
      "createdDay": 1,
      "door": null,
      "history": []
    },
    {
      "id": "H:9:6",
      "key": "H:9:6",
      "kind": "wall",
      "materialId": "timber_frame",
      "condition": 73,
      "loadBearing": false,
      "createdDay": 1,
      "door": null,
      "history": []
    },
    {
      "id": "V:12:0",
      "key": "V:12:0",
      "kind": "wall",
      "materialId": "timber_frame",
      "condition": 73,
      "loadBearing": false,
      "createdDay": 1,
      "door": null,
      "history": []
    },
    {
      "id": "V:12:1",
      "key": "V:12:1",
      "kind": "wall",
      "materialId": "timber_frame",
      "condition": 73,
      "loadBearing": false,
      "createdDay": 1,
      "door": null,
      "history": []
    },
    {
      "id": "V:12:2",
      "key": "V:12:2",
      "kind": "wall",
      "materialId": "timber_frame",
      "condition": 73,
      "loadBearing": false,
      "createdDay": 1,
      "door": null,
      "history": []
    },
    {
      "id": "V:4:6",
      "key": "V:4:6",
      "kind": "wall",
      "materialId": "timber_frame",
      "condition": 73,
      "loadBearing": false,
      "createdDay": 1,
      "door": null,
      "history": []
    },
    {
      "id": "V:4:7",
      "key": "V:4:7",
      "kind": "door",
      "materialId": "timber_frame",
      "condition": 73,
      "loadBearing": false,
      "createdDay": 1,
      "door": {
        "styleId": "simple",
        "open": true,
        "lockPolicy": "household_members",
        "condition": 84
      },
      "history": []
    },
    {
      "id": "V:4:8",
      "key": "V:4:8",
      "kind": "wall",
      "materialId": "timber_frame",
      "condition": 73,
      "loadBearing": false,
      "createdDay": 1,
      "door": null,
      "history": []
    },
    {
      "id": "V:4:9",
      "key": "V:4:9",
      "kind": "wall",
      "materialId": "timber_frame",
      "condition": 73,
      "loadBearing": false,
      "createdDay": 1,
      "door": null,
      "history": []
    },
    {
      "id": "V:8:3",
      "key": "V:8:3",
      "kind": "wall",
      "materialId": "timber_frame",
      "condition": 73,
      "loadBearing": false,
      "createdDay": 1,
      "door": null,
      "history": []
    },
    {
      "id": "V:8:4",
      "key": "V:8:4",
      "kind": "wall",
      "materialId": "timber_frame",
      "condition": 73,
      "loadBearing": false,
      "createdDay": 1,
      "door": null,
      "history": []
    },
    {
      "id": "V:8:5",
      "key": "V:8:5",
      "kind": "wall",
      "materialId": "timber_frame",
      "condition": 73,
      "loadBearing": false,
      "createdDay": 1,
      "door": null,
      "history": []
    },
    {
      "id": "V:8:6",
      "key": "V:8:6",
      "kind": "door",
      "materialId": "timber_frame",
      "condition": 73,
      "loadBearing": false,
      "createdDay": 1,
      "door": {
        "styleId": "simple",
        "open": true,
        "lockPolicy": "household_members",
        "condition": 84
      },
      "history": []
    },
    {
      "id": "V:8:7",
      "key": "V:8:7",
      "kind": "wall",
      "materialId": "timber_frame",
      "condition": 73,
      "loadBearing": false,
      "createdDay": 1,
      "door": null,
      "history": []
    },
    {
      "id": "V:8:8",
      "key": "V:8:8",
      "kind": "wall",
      "materialId": "timber_frame",
      "condition": 73,
      "loadBearing": false,
      "createdDay": 1,
      "door": null,
      "history": []
    },
    {
      "id": "V:8:9",
      "key": "V:8:9",
      "kind": "wall",
      "materialId": "timber_frame",
      "condition": 73,
      "loadBearing": false,
      "createdDay": 1,
      "door": null,
      "history": []
    }
  ],
  "rooms": [
    {
      "id": "room_home_garden_2_001",
      "name": "Kitchen",
      "purpose": "kitchen",
      "purposeSource": "inferred",
      "cells": [
        "0,0",
        "1,0",
        "2,0",
        "3,0",
        "4,0",
        "5,0",
        "6,0",
        "7,0",
        "8,0",
        "9,0",
        "10,0",
        "11,0",
        "0,1",
        "1,1",
        "2,1",
        "3,1",
        "4,1",
        "5,1",
        "6,1",
        "7,1",
        "8,1",
        "9,1",
        "10,1",
        "11,1",
        "0,2",
        "1,2",
        "2,2",
        "3,2",
        "4,2",
        "5,2",
        "6,2",
        "7,2",
        "8,2",
        "9,2",
        "10,2",
        "11,2",
        "0,3",
        "1,3",
        "2,3",
        "3,3",
        "4,3",
        "5,3",
        "6,3",
        "7,3",
        "8,3",
        "9,3",
        "10,3",
        "11,3",
        "12,3",
        "13,3",
        "14,3",
        "0,4",
        "1,4",
        "2,4",
        "3,4",
        "4,4",
        "5,4",
        "6,4",
        "7,4",
        "8,4",
        "9,4",
        "10,4",
        "11,4",
        "12,4",
        "13,4",
        "14,4",
        "0,5",
        "1,5",
        "2,5",
        "3,5",
        "4,5",
        "5,5",
        "6,5",
        "7,5",
        "8,5",
        "9,5",
        "10,5",
        "11,5",
        "12,5",
        "13,5",
        "14,5"
      ],
      "anchor": {
        "x": 0,
        "y": 0
      },